{
  "benchmark_id": "DG-BM-003",
  "status": "exploratory",
  "repository": {
    "name": "DeployGuard",
    "url": "https://github.com/gODtECH-Ctl-Create/deployguard"
  },
  "base_commit": "e552e0e",
  "task_area": "Database migration",
  "task_summary": "Add PostgreSQL-backed incident audit events for created, updated and deleted incident activity.",
  "controlled": false,
  "runs": {
    "control": {
      "branch": "not-run",
      "commit": null,
      "unique_files_inspected": 0,
      "inspected_files": [],
      "files_edited": [],
      "failed_commands": 0,
      "implementation_retries": 0,
      "human_interventions": 0,
      "verification": [
        {
          "command": "control run",
          "outcome": "not_run",
          "notes": "A plain-AI control branch was not executed before the FORGE-assisted implementation was merged."
        }
      ],
      "forge_metrics": null,
      "provider_billing": null
    },
    "forge_assisted": {
      "branch": "db/dg-bm-003-incident-audit-events",
      "commit": "d40758b",
      "unique_files_inspected": 9,
      "inspected_files": [
        "README.md",
        "package.json",
        "apps/api/package.json",
        "apps/api/src/app.ts",
        "apps/api/src/incidents.ts",
        "apps/api/src/server.ts",
        "apps/api/tests/incidents.test.ts",
        "docker-compose.yml",
        "forge/evidence/tasks/deployguard-dg-bm-003.md"
      ],
      "files_edited": [
        "README.md",
        "apps/api/src/app.ts",
        "apps/api/src/incidents.ts",
        "apps/api/tests/incidents.test.ts"
      ],
      "failed_commands": 0,
      "implementation_retries": 0,
      "human_interventions": 1,
      "verification": [
        {
          "command": "npm run test --workspace=@deployguard/api",
          "outcome": "passed",
          "notes": "5/5 API tests passed locally, including incident audit event coverage."
        },
        {
          "command": "npm run typecheck --workspace=@deployguard/api",
          "outcome": "passed"
        },
        {
          "command": "npm run build --workspace=@deployguard/api",
          "outcome": "passed"
        },
        {
          "command": "npm run typecheck",
          "outcome": "passed"
        },
        {
          "command": "npm run build",
          "outcome": "passed"
        }
      ],
      "forge_metrics": null,
      "provider_billing": null
    }
  },
  "comparisons": {
    "unique_files_inspected_reduction_percent": null,
    "estimated_context_reduction_percent": null,
    "provider_credit_savings": null
  },
  "limitations": [
    "This result is exploratory because a plain-AI control run was not executed from the same base commit.",
    "Provider token, credit and exact tool-call telemetry were unavailable.",
    "FORGE metrics were not captured through a local forge prepare event for this run.",
    "The schema change currently lives in DeployGuard startup initialization rather than a standalone migration tool."
  ],
  "claim_boundaries": [
    "DG-BM-003 is not a controlled benchmark result.",
    "This result proves the database-backed audit behavior was implemented and verified, not that FORGE reduced provider tokens or credits.",
    "No provider-token or credit-savings claim is made for this run."
  ]
}
